{
  "workflow_key": "partner_enrich",
  "run_id": "dedup-1111-2222-3333-444444444444",
  "org_name": "Dedupe Test Org",
  "website_url": "https://dedupetest.org",
  "payload": {
    "mission_summary": "Updated mission for same run_id.",
    "programs": ["Program B", "Program C"],
    "populations_served": ["different-pop"],
    "geographies": ["Canada"],
    "funding_signals": ["New grant 2026"],
    "keywords": ["dedupe", "updated"]
  }
}
